id,title,description,credits,prerequisites,level,difficulty_rating,career_relevance,topics,semester_offered,professor,department
PE128,Hydrofitness,Water fitness designed to tone muscle groups and strengthen cardiovascular system with aerobic exercises.,1,None,Freshman,1.5,"Water Fitness, Aquatic Exercise","Water Fitness, Aquatic Exercise, Cardiovascular Training, Muscle Toning",Fall/Spring,TBD,Physical Education
PE129,Individualized Fitness,Specific training to meet individual student interests including strength training goal setting and record keeping.,1,None,Freshman,1.5,"Individualized Fitness, Personal Training","Individualized Fitness, Personal Training, Strength Training, Goal Setting",Fall/Spring,TBD,Physical Education
PE131,Step Aerobics,High-intensity aerobic workout using Reebok Step to increase cardiovascular strength and endurance.,1,None,Sophomore,2.0,"Step Aerobics, High-Intensity Fitness","Step Aerobics, High-Intensity Fitness, Cardiovascular Training, Aerobic Exercise",Fall/Spring,TBD,Physical Education
PE132,Aerobics,Designed for cardiovascular conditioning weight loss and muscle toning through aerobic exercise.,1,None,Freshman,1.5,"Aerobics, Cardiovascular Conditioning","Aerobics, Cardiovascular Conditioning, Weight Management, Muscle Toning",Fall/Spring,TBD,Physical Education
PE133,Swim for Health,Concentrated program teaching techniques for individualized swimming training programs for health and fitness.,1,"Must be able to swim",Sophomore,2.0,"Swimming Fitness, Health Swimming","Swimming Fitness, Health Swimming, Training Programs, Aquatic Fitness",Fall/Spring,TBD,Physical Education
PE135,Beginning Swimming,Designed for non-swimmers including survival techniques and basic rescue methods.,1,None,Freshman,1.5,"Beginning Swimming, Water Safety","Beginning Swimming, Water Safety, Basic Rescue, Aquatic Skills",Fall/Spring,TBD,Physical Education
PE136,Beginning Karate,Introduction to shotokan karate including basic self-defense with optional martial arts uniform.,1,None,Sophomore,2.0,"Karate, Martial Arts","Karate, Martial Arts, Self-Defense, Japanese Martial Arts",Fall/Spring,TBD,Physical Education
PE137,Intermediate Karate,Continuation of PE136 including katas Japanese terms and complex self-defense with required uniform.,1,"PE136 or instructor permission",Sophomore,2.5,"Intermediate Karate, Advanced Martial Arts","Intermediate Karate, Advanced Martial Arts, Katas, Self-Defense",Fall/Spring,TBD,Physical Education
PE139,Individualized Fitness II,Designed to increase cardiovascular efficiency muscular strength and endurance through continuing specific training.,1,"PE129 or instructor permission",Sophomore,2.0,"Advanced Fitness, Continued Training","Advanced Fitness, Continued Training, Cardiovascular Efficiency, Muscular Strength",Fall/Spring,TBD,Physical Education
PE140,Circuit Training,Low-impact aerobic program utilizing weights to increase flexibility coordination muscle tone and cardiovascular endurance.,1,None,Sophomore,2.0,"Circuit Training, Weight Training","Circuit Training, Weight Training, Flexibility, Coordination",Fall/Spring,TBD,Physical Education
PE141,Introduction to Dance,Introduction to several dance styles including ballet modern jazz tap folk ethnic and social dance.,1,None,Freshman,1.5,"Dance, Movement Arts","Dance, Movement Arts, Ballet, Modern Dance, Cultural Dance",Fall/Spring,TBD,Physical Education
PE145,Air Force Physical Training I,Air Force-sponsored physical training for AFROTC students including conditioning exercises and fitness assessments.,1,"AFROTC enrollment",Sophomore,2.0,"Military Fitness, Air Force Training","Military Fitness, Air Force Training, Physical Assessment, Conditioning",Fall/Spring,TBD,Physical Education
PE150,Beginning Yoga,Introduces ancient discipline balancing body mind and spirit with physical postures relaxation and meditation.,1,None,Freshman,1.5,"Yoga, Mind-Body Wellness","Yoga, Mind-Body Wellness, Meditation, Flexibility, Stress Relief",Fall/Spring,TBD,Physical Education
PE151,Intermediate Yoga,Deepens yoga study and practice with advanced poses breathing techniques and deeper philosophical understanding.,1,None,Sophomore,2.0,"Intermediate Yoga, Advanced Wellness","Intermediate Yoga, Advanced Wellness, Advanced Poses, Breathing Techniques",Fall/Spring,TBD,Physical Education
PE170,Modern Dance,Provides basis for understanding dance as art form through fundamental movement principles and modern techniques.,1,None,Sophomore,2.0,"Modern Dance, Dance Arts","Modern Dance, Dance Arts, Movement Principles, Creative Expression",Fall/Spring,TBD,Physical Education
PE171,Latin Dance,Focus on training students in basic ballroom and Latin steps turns partnering with rhythms and cultural history.,1,None,Sophomore,2.0,"Latin Dance, Ballroom Dance","Latin Dance, Ballroom Dance, Cultural Dance, Partner Dancing",Fall/Spring,TBD,Physical Education
PE180,Zumba Fitness,Combines Latin dance styles with aerobic fitness interval training for calorie burning and body sculpting.,1,None,Freshman,1.5,"Zumba, Dance Fitness","Zumba, Dance Fitness, Latin Dance, Aerobic Training",Fall/Spring,TBD,Physical Education
PE201,Introduction to Lifetime Sports I,Fall semester introduction to variety of individual dual and team sports available at NJIT.,1,None,Sophomore,1.5,"Lifetime Sports, Recreation","Lifetime Sports, Recreation, Individual Sports, Team Sports",Fall/Spring,TBD,Physical Education
PE202,Lifetime Sports II,Continuation of PE101 participating in variety of activities or developing areas of concentration.,1,None,Sophomore,1.5,"Lifetime Sports, Sport Development","Lifetime Sports, Sport Development, Recreation, Sport Concentration",Fall/Spring,TBD,Physical Education
PE208,Sports for Women,Designed specifically for women interested in learning and competing in individual dual and team sports.,1,None,Sophomore,1.5,"Women's Sports, Athletic Development","Women's Sports, Athletic Development, Competition, Team Sports",Fall/Spring,TBD,Physical Education
PE210,Skiing,Instruction and practical experience in recreational skiing for novice and intermediate skiers with safety emphasis.,1,None,Sophomore,2.0,"Skiing, Winter Sports","Skiing, Winter Sports, Recreation, Safety Techniques",Fall/Spring,TBD,Physical Education
PE211,Introduction to Bowling and Archery,Rules techniques and scoring of bowling and archery sports with equipment provided for archery.,1,None,Sophomore,1.5,"Bowling, Archery","Bowling, Archery, Target Sports, Recreation",Fall/Spring,TBD,Physical Education
PE213,Volleyball,Learn current volleyball techniques and skills progressing from triples to competitive team volleyball.,1,None,Sophomore,2.0,"Volleyball, Team Sports","Volleyball, Team Sports, Athletic Skills, Competition",Fall/Spring,TBD,Physical Education
PE214,Advanced Volleyball,Advanced volleyball methods including spikes serves blocks sets team strategy and tournament play.,1,"PE113 or instructor approval",Junior,2.5,"Advanced Volleyball, Competitive Sports","Advanced Volleyball, Competitive Sports, Team Strategy, Tournament Play",Fall/Spring,TBD,Physical Education
PE220,Introduction to Racquet Sports,Introduction to badminton paddleball tennis and racquetball including rules strokes and playing strategy.,1,None,Sophomore,2.0,"Racquet Sports, Individual Sports","Racquet Sports, Individual Sports, Tennis, Badminton, Strategy",Fall/Spring,TBD,Physical Education
PE221,Badminton,Includes rules skills strokes and strategies of badminton with opportunity for competition.,1,None,Sophomore,1.5,"Badminton, Racquet Sports","Badminton, Racquet Sports, Competition, Athletic Skills",Fall/Spring,TBD,Physical Education
PE223,Tennis for Beginners,Introduces students to rules basic techniques and strategies of tennis for beginning players.,1,None,Sophomore,2.0,"Beginning Tennis, Racquet Sports","Beginning Tennis, Racquet Sports, Athletic Skills, Recreation",Fall/Spring,TBD,Physical Education
PE224,Intermediate Tennis,Emphasizes correcting problem strokes strategies drills and tournament play for advancing tennis players.,1,"PE223 or instructor permission",Junior,2.5,"Intermediate Tennis, Advanced Sports","Intermediate Tennis, Advanced Sports, Tournament Play, Skill Development",Fall/Spring,TBD,Physical Education
PE225,Golf,Designed for beginners covering grip stance swing strokes and club use progressing to actual course play.,1,None,Sophomore,2.0,"Golf, Individual Sports","Golf, Individual Sports, Recreation, Course Play",Fall/Spring,TBD,Physical Education
PE226,Intermediate Golf,Designed to strengthen and advance skills and theory learned in beginning golf course.,1,"PE225 or instructor permission",Junior,2.5,"Intermediate Golf, Advanced Sports","Intermediate Golf, Advanced Sports, Skill Development, Course Strategy",Fall/Spring,TBD,Physical Education
PE234,Beginning Fencing,Introduces fencing as both lifetime and intercollegiate sport with basic equipment provided.,1,None,Sophomore,2.0,"Fencing, Individual Sports","Fencing, Individual Sports, Swordsmanship, Competition",Fall/Spring,TBD,Physical Education
PE242,Introduction to Racquetball,Introduction to racquetball rules skill development strategies and tournament play.,1,None,Sophomore,2.0,"Racquetball, Racquet Sports","Racquetball, Racquet Sports, Competition, Athletic Skills",Fall/Spring,TBD,Physical Education
PE243,Introduction to Volleyball,Introduction to volleyball rules skill development strategies and tournament play.,1,None,Sophomore,1.5,"Volleyball Introduction, Team Sports","Volleyball Introduction, Team Sports, Athletic Skills, Competition",Fall/Spring,TBD,Physical Education
PE244,Advanced Racquetball,Advanced racquetball methods including various serves shots advanced strategy and tournament play.,1,"PE242 or instructor permission",Junior,2.5,"Advanced Racquetball, Competitive Sports","Advanced Racquetball, Competitive Sports, Tournament Play, Advanced Strategy",Fall/Spring,TBD,Physical Education
PE245,Air Force Physical Training II,Continuation of Air Force physical training for AFROTC students with advanced conditioning and assessments.,1,"AFROTC enrollment",Junior,2.5,"Advanced Military Fitness, Air Force Training","Advanced Military Fitness, Air Force Training, Physical Assessment, Advanced Conditioning",Fall/Spring,TBD,Physical Education
PHIL310,Logic,Teaches critical reasoning argument construction and evaluation including informal logic fallacies and formal symbolic logic.,3,"ENGL102 with C and one 200-level H&H GER with C or higher",Junior,3.5,"Logic, Critical Thinking","Logic, Critical Thinking, Reasoning, Argumentation, Symbolic Logic",Fall/Spring,TBD,Philosophy
PHIL331,Problems in Philosophy,Examination of social ethical aesthetic religious and scientific problems with philosophical analysis and principles.,3,"HUM102 with C and one 200-level H&H GER with C or higher",Junior,4.0,"Philosophy Problems, Philosophical Analysis","Philosophy Problems, Philosophical Analysis, Ethics, Social Issues, Critical Analysis",Fall/Spring,TBD,Philosophy
PHIL333,Moral Philosophy,Critical discussion of history and fundamental elements of ethical thought including basic ethical theories.,3,"ENGL102 with C and one 200-level H&H GER with C or higher",Junior,4.0,"Moral Philosophy, Ethics","Moral Philosophy, Ethics, Ethical Theory, Moral Choice, Ethical Reasoning",Fall/Spring,TBD,Philosophy
PHIL334,Engineering Ethics and Technological Practice,Philosophical examination of engineering practice and applied technology including moral obligations and ethical duties.,3,"ENGL102 with C and one 200-level H&H GER with C or higher",Junior,4.0,"Engineering Ethics, Technology Ethics","Engineering Ethics, Technology Ethics, Professional Ethics, Moral Obligations",Fall/Spring,TBD,Philosophy
PHIL335,Ethical Issues in Business,Examination of ethical problems and moral foundations of business from moral philosophy perspective.,3,"ENGL101 and ENGL102 with C or higher",Junior,3.5,"Business Ethics, Corporate Ethics","Business Ethics, Corporate Ethics, Professional Ethics, Moral Philosophy",Fall/Spring,TBD,Philosophy
PHIL337,World Religions,Introduction to five universal world religions examining their impact on contemporary politics gender economics and culture.,3,"ENGL102 with C and one 200-level H&H GER with C or higher",Junior,3.0,"World Religions, Religious Studies","World Religions, Religious Studies, Comparative Religion, Cultural Studies",Fall/Spring,TBD,Philosophy
PHIL350,Representative Philosophies,Ideas of great thinkers from various historical periods showing intellectual progress and modern problem solutions.,3,"ENGL102 with C and one 200-level H&H GER with C or higher",Junior,4.0,"History of Philosophy, Philosophical Thought","History of Philosophy, Philosophical Thought, Great Philosophers, Intellectual History",Fall/Spring,TBD,Philosophy
PHIL351,Biomedical Ethics,Examination of ethical problems and moral foundations of medicine including patient autonomy and end-of-life issues.,3,"ENGL102 with C and one 200-level H&H GER with C or higher",Junior,4.0,"Biomedical Ethics, Medical Ethics","Biomedical Ethics, Medical Ethics, Healthcare Ethics, Patient Rights",Fall/Spring,TBD,Philosophy
PHIL355,The Philosophy of Science,Investigation into foundations and implications of modern science emphasizing philosophy's influence on scientific thought.,3,"ENGL102 with C and one 200-level H&H GER with C or higher",Junior,4.0,"Philosophy of Science, Scientific Method","Philosophy of Science, Scientific Method, Scientific Knowledge, Epistemology",Fall/Spring,TBD,Philosophy
PHIL380,Philosophy of Language,Examines tradition formation and change in ways language shapes thought including language relationships with religion and science.,3,"ENGL102 with C and one 200-level H&H GER with C or higher",Junior,4.0,"Philosophy of Language, Linguistics","Philosophy of Language, Linguistics, Language and Thought, Communication Theory",Fall/Spring,TBD,Philosophy
PHYS102,General Physics I,Elementary statics and dynamics including kinematics Newton's laws energy momentum and conservation principles.,3,"PHYS102A corequisite",Freshman,3.0,"General Physics, Mechanics","General Physics, Mechanics, Kinematics, Conservation Laws, Newton's Laws",Fall/Spring,TBD,Physics
PHYS102A,General Physics I Lab,Laboratory component of PHYS102 providing hands-on experience with basic physics principles.,1,"PHYS102 corequisite",Freshman,2.5,"Physics Laboratory, Experimental Physics","Physics Laboratory, Experimental Physics, Laboratory Skills, Measurement",Fall/Spring,TBD,Physics
PHYS103,General Physics II,Continuation of PHYS102 covering heat thermodynamics sound wave motion optics and color.,3,"PHYS102/PHYS102A with C, PHYS103A corequisite",Sophomore,3.5,"General Physics, Thermodynamics","General Physics, Thermodynamics, Wave Motion, Optics, Sound",Fall/Spring,TBD,Physics
PHYS103A,General Physics II Lab,Laboratory component of PHYS103 providing experimental experience with thermodynamics and optics.,1,"PHYS102/PHYS102A with C, PHYS103 corequisite",Sophomore,3.0,"Physics Laboratory, Experimental Physics","Physics Laboratory, Experimental Physics, Thermodynamics Lab, Optics Lab",Fall/Spring,TBD,Physics
PHYS111,Physics I,Elementary mechanics emphasizing fundamental concepts conservation laws and vector quantities of mechanics.,3,"PHYS111A and MATH111 corequisites",Sophomore,4.0,"Physics, Mechanics","Physics, Mechanics, Conservation Laws, Vector Analysis, Newton's Laws",Fall/Spring,TBD,Physics
PHYS111A,Physics I Lab,Laboratory component of PHYS111 providing experimental experience with mechanical principles.,1,"PHYS111 corequisite",Sophomore,3.5,"Physics Laboratory, Mechanics Lab","Physics Laboratory, Mechanics Lab, Experimental Physics, Laboratory Skills",Fall/Spring,TBD,Physics
PHYS114,Introduction to Data Reduction with Applications,Introduction to error analysis data reduction methodology and statistical analysis for physics majors.,3,"MATH111 corequisite, Physics majors only",Sophomore,3.5,"Data Analysis, Statistical Methods","Data Analysis, Statistical Methods, Error Analysis, Statistical Physics",Fall/Spring,TBD,Physics
PHYS121,Physics II,Introduction to electricity and magnetism including circuits electric and magnetic fields and electromagnetic relationships.,3,"PHYS111/PHYS111A and MATH111 with C, PHYS121A and MATH112 corequisites",Sophomore,4.5,"Electricity and Magnetism, Electromagnetic Theory","Electricity and Magnetism, Electromagnetic Theory, Circuit Analysis, Electric Fields",Fall/Spring,TBD,Physics
PHYS121A,Physics II Lab,Laboratory component of PHYS121 providing experimental experience with electricity and magnetism.,1,"PHYS111/PHYS111A and MATH111 with C, PHYS121 corequisite",Sophomore,4.0,"Physics Laboratory, Electromagnetic Lab","Physics Laboratory, Electromagnetic Lab, Circuit Lab, Experimental Physics",Fall/Spring,TBD,Physics
PHYS122,Electricity & Magnetism ECE Applications,Emphasizes electrical engineering applications with complex variables and linear problem solving methods.,3,"PHYS111/PHYS111A and MATH111 with C, PHYS121A and MATH112 corequisites",Sophomore,4.5,"Electromagnetic Applications, Engineering Physics","Electromagnetic Applications, Engineering Physics, Complex Variables, Circuit Applications",Fall/Spring,TBD,Physics
PHYS202,Introductory Astronomy and Cosmology,Non-mathematical presentation of contemporary views of universe origin evolution and structure.,3,None,Sophomore,2.5,"Astronomy, Cosmology","Astronomy, Cosmology, Solar System, Stars, Galaxies, Big Bang",Fall/Spring,TBD,Physics
PHYS202A,Astronomy and Cosmology Laboratory,Demonstration of astronomical principles with telescope observations of lunar solar and planetary objects.,1,None,Sophomore,2.0,"Astronomy Laboratory, Observational Astronomy","Astronomy Laboratory, Observational Astronomy, Telescope Use, Celestial Observations",Fall/Spring,TBD,Physics
PHYS203,The Earth in Space,Introduces fundamental Earth phenomena including plate tectonics erosion volcanism and Earth-Sun-Moon interactions.,3,None,Sophomore,3.0,"Earth Science, Planetary Science","Earth Science, Planetary Science, Geology, Atmospheric Science, Solar System",Fall/Spring,TBD,Physics
PHYS203A,The Earth in Space Lab,Laboratory component providing hands-on experience with Earth science principles and phenomena.,1,"PHYS203 corequisite",Sophomore,2.5,"Earth Science Laboratory, Geology Lab","Earth Science Laboratory, Geology Lab, Planetary Science Lab, Environmental Science",Fall/Spring,TBD,Physics
PHYS204,Biophysics of Life,Quantitative non-mathematical view of living entities using basic physics and biology concepts.,3,None,Sophomore,3.0,"Biophysics, Life Sciences","Biophysics, Life Sciences, Biological Physics, Living Systems Physics",Fall/Spring,TBD,Physics
PHYS231A,Physics III Lab,Laboratory component for advanced physics covering physical optics and modern physics experiments.,1,"PHYS111/PHYS111A and PHYS121/PHYS121A and MATH112 with C, PHYS231H or PHYS234 corequisite",Junior,4.0,"Advanced Physics Laboratory, Modern Physics Lab","Advanced Physics Laboratory, Modern Physics Lab, Optics Lab, Quantum Physics Lab",Fall/Spring,TBD,Physics
PHYS231H,Physics III Honors,Honors version of third semester physics with detailed physical optics and modern physics emphasis.,4,"PHYS111/PHYS111A and PHYS121/PHYS121A and MATH111 and MATH112 with C",Junior,4.5,"Honors Physics, Advanced Modern Physics","Honors Physics, Advanced Modern Physics, Wave-Particle Duality, Quantum Physics",Fall/Spring,TBD,Physics
PHYS234,Physics III,Simple harmonic motion wave motion optics and modern physics including wave-particle duality.,3,"PHYS121/PHYS121A or PHYS122/PHYS121A and MATH112 with C",Junior,4.0,"Modern Physics, Wave Physics","Modern Physics, Wave Physics, Optics, Quantum Mechanics, Relativity",Fall/Spring,TBD,Physics
PHYS310,Introduction to Atomic and Nuclear Physics,Selected topics in atomic and nuclear physics including shell models radiation and nuclear detectors.,3,"PHYS234 and MATH222 with C",Senior,4.5,"Atomic Physics, Nuclear Physics","Atomic Physics, Nuclear Physics, Quantum Mechanics, Radiation, Nuclear Structure",Fall/Spring,TBD,Physics
PHYS311,Co-op Work Experience I,Students gain major-related work experience and academic program reinforcement through cooperative education.,3,"Acceptance into co-op program",Junior,2.5,"Work Experience, Professional Development","Work Experience, Professional Development, Career Skills, Industry Experience",Fall/Spring,TBD,Physics
PHYS320,Astronomy and Astrophysics I,Quantitative introduction to astronomy of sun earth and solar system emphasizing physical principles.,3,"PHYS121 with C",Junior,4.0,"Astronomy, Astrophysics","Astronomy, Astrophysics, Celestial Mechanics, Planetary Physics, Solar System",Fall/Spring,TBD,Physics
PHYS321,Astronomy and Astrophysics II,Quantitative introduction to stellar astronomy galactic dynamics and cosmology with physical principles.,3,"PHYS320 with C",Senior,4.5,"Stellar Astronomy, Cosmology","Stellar Astronomy, Cosmology, Galactic Dynamics, Stellar Evolution, Universe Structure",Fall/Spring,TBD,Physics
PHYS322,Observational Astronomy,Observatory-based observations of celestial objects including experimental projects and astrophotography.,3,"PHYS320 with C",Senior,4.0,"Observational Astronomy, Astronomical Techniques","Observational Astronomy, Astronomical Techniques, Telescope Use, Astrophotography",Fall/Spring,TBD,Physics
PHYS335,Introductory Thermodynamics,Introductory thermodynamics kinetic theory and statistical physics including laws of thermodynamics.,3,"PHYS234 or PHYS231 and MATH211 or MATH213 with C",Junior,4.0,"Thermodynamics, Statistical Physics","Thermodynamics, Statistical Physics, Kinetic Theory, Thermal Physics",Fall/Spring,TBD,Physics
PHYS350,Biophysics I,Introduction to general biophysics including cellular biophysics molecular forces and biological system physics.,3,"PHYS121 with C",Junior,4.0,"Biophysics, Biological Physics","Biophysics, Biological Physics, Cellular Physics, Molecular Biophysics, Membrane Physics",Fall/Spring,TBD,Physics
PHYS390,Selected Topics of Current Interest in Physics,Seminar covering current forefront topics in physics including nuclear solid state and relativity.,1,"PHYS234 with C",Senior,3.0,"Current Physics Topics, Physics Seminar","Current Physics Topics, Physics Seminar, Nuclear Physics, Solid State, Relativity",Fall/Spring,TBD,Physics
PHYS411,Co-op Work Experience II,Advanced cooperative education providing additional major-related work experience and professional development.,3,"PHYS311 with C and co-op program acceptance",Senior,3.0,"Advanced Work Experience, Professional Development","Advanced Work Experience, Professional Development, Career Skills, Industry Experience",Fall/Spring,TBD,Physics
PHYS418,Fundamentals of Optical Imaging,Combined lecture and laboratory course emphasizing hands-on experience with optical imaging systems.,3,"PHYS234 or PHYS231 with C",Senior,4.0,"Optical Imaging, Applied Optics","Optical Imaging, Applied Optics, Image Formation, Optical Systems, Image Processing",Fall/Spring,TBD,Physics
PHYS420,Special Relativity,Introduction to Einstein's Special Theory of Relativity at advanced undergraduate level.,3,"PHYS234 and MATH222 with C",Senior,4.5,"Special Relativity, Theoretical Physics","Special Relativity, Theoretical Physics, Spacetime, Relativistic Mechanics, Modern Physics",Fall/Spring,TBD,Physics
PHYS421,General Relativity,Introduction to Einstein's General Theory of Relativity including gravitation and cosmology.,3,"PHYS234 and MATH222 with C",Senior,4.5,"General Relativity, Gravitational Physics","General Relativity, Gravitational Physics, Cosmology, Black Holes, Spacetime Curvature",Fall/Spring,TBD,Physics
PHYS430,Classical Mechanics I,Newtonian mechanics of particles and systems using Lagrangian and Hamiltonian approaches.,3,"PHYS234 and MATH222 and MATH328 or MATH335 with C",Senior,4.5,"Classical Mechanics, Theoretical Physics","Classical Mechanics, Theoretical Physics, Lagrangian Mechanics, Hamiltonian Mechanics",Fall/Spring,TBD,Physics
PHYS431,Classical Mechanics II,Theory of small oscillations mechanical waves rigid bodies and continuum mechanics.,3,"PHYS430 with C",Senior,4.5,"Advanced Classical Mechanics, Wave Theory","Advanced Classical Mechanics, Wave Theory, Oscillations, Rigid Body Dynamics",Fall/Spring,TBD,Physics
PHYS432,Electromagnetism I,Electrostatics magnetostatics Maxwell's equations and electrodynamics at advanced undergraduate level.,3,"PHYS234 or PHYS234H or PHYS231H and MATH222 and MATH328 or MATH335 with C",Senior,4.5,"Electromagnetism, Classical Field Theory","Electromagnetism, Classical Field Theory, Maxwell's Equations, Electromagnetic Waves",Fall/Spring,TBD,Physics
PHYS433,Electromagnetism II,Advanced applications of Maxwell's equations and electrodynamics including electromagnetic radiation.,3,"PHYS432 with C",Senior,4.5,"Advanced Electromagnetism, Electromagnetic Radiation","Advanced Electromagnetism, Electromagnetic Radiation, Wave Propagation, Field Theory",Fall/Spring,TBD,Physics
PHYS441,Modern Physics,Wave-particle duality wave mechanics quantum systems solid state physics and plasma systems.,3,"PHYS234 or PHYS231 and MATH222 with C",Senior,4.0,"Modern Physics, Quantum Physics","Modern Physics, Quantum Physics, Solid State Physics, Band Theory, Quantum Mechanics",Fall/Spring,TBD,Physics
PHYS442,Introduction to Quantum Mechanics,Wave-particle duality Schrodinger and Heisenberg formulations hydrogen atom and perturbation theory.,3,"PHYS430 with C",Senior,4.5,"Quantum Mechanics, Theoretical Physics","Quantum Mechanics, Theoretical Physics, Schrodinger Equation, Hydrogen Atom, Perturbation Theory",Fall/Spring,TBD,Physics
